,doi,type,text_redacted
4247,10.1016/j.matchemphys.2016.05.039,something_else,"Analytical reagents and distilled water were used  ... or use, and its composition was listed in Table 2."
4248,10.1016/j.apsusc.2011.08.060,something_else,The polycrystalline diamond films (including micro ... ere drawn out and cooled to room temperature (RT).
4249,10.1016/j.apcata.2007.06.014,something_else,Activity tests were carried out at 700 degC in a f ... of 20 ml/min of pure hydrogen for 3 h at 550 degC.
4250,10.1016/j.apcata.2007.06.014,something_else,Ni-Si (molar ratio 2:1) and Ni-Cu-Si (molar ratio  ... talysts were finally calcined at 450 degC for 8 h.
4251,10.1016/j.jeurceramsoc.2013.10.031,something_else,"Commercially available, high-purity Y2O3 powder (B ... nd a rectangular cross section of 3.5 mm x 1.0 mm."
4252,10.1016/j.bbamcr.2013.02.011,something_else,Exposure to LEF or extracellular acidification doe ... endent experiments where bars represent the range.
4253,10.1016/j.bbamcr.2013.02.011,something_else,Involvement of pH changes in EGFR phosphorylation. ... endent experiments where bars represent the range.
4254,10.1016/j.bbamcr.2013.02.011,something_else,"Electrochemically produced ROS following exposure  ... HA, as indicated, using regular two-tailed t-test."
4255,10.1016/j.bbamcr.2013.02.011,something_else,"Analysis of LEF-induced EGFR and ERK phosphorylati ...  0.001, relative to control, by one-sample t-test."
4256,10.1016/j.matchemphys.2016.05.039,something_else,"The specimens in ring form (thickness: 80 mm, oute ... in distilled water within the hour before testing."
4257,10.1016/j.bbamcr.2013.02.011,something_else,LEF induced EGFR and ERK phosphorylation in both C ...  viability as measured by FACS using PI exclusion.
4258,10.1016/j.bbamcr.2013.02.011,something_else,Changes in ROS level were determined using H2DCF-D ...  using WINMDI flow cytometry application software.
4259,10.1016/j.bbamcr.2013.02.011,something_else,"After exposure to the different stimuli, cells wer ... rce) according to the manufacturer's instructions."
4260,10.1016/j.bbamcr.2013.02.011,something_else,Total protein measurement was performed after cell ... rce) according to the manufacturer's instructions.
4261,10.1016/j.bbamcr.2013.02.011,something_else,Cell viability was detected using propidium iodide ... s using Elisa Reader as described previously [65].
4262,10.1016/j.bbamcr.2013.02.011,something_else,The measurement of the medium's pH in the three co ... ntral compartment and pH >= 10 in the cathode one.
4263,10.1016/j.bbamcr.2013.02.011,something_else,"In selected experiments, cells were pre-incubated  ... M + 25 mM Hepes at pH 7.4 before Western Blotting."
4264,10.1016/j.bbamcr.2013.02.011,something_else,"COS5-7 (fibroblast-like cells), African green monk ...  in serum-free DMEM at room temperature for 5 min."
4265,10.1016/j.bbamcr.2013.02.011,something_else,Phospho-EGF receptor (Tyr1173) (53A5) rabbit mAb w ... inimidyl) suberate (BS3) was obtained from Pierce.
4266,10.1016/j.bbamcr.2013.02.011,something_else,"After different treatments, cells were washed with ... 5) followed by a secondary antibody linked to HRP."
4267,10.1007/s10853-012-6376-4,something_else,Flexural tests under three-point bend configuratio ...  materials were prepared for static flexure tests.
4268,10.1007/s10853-012-6376-4,something_else,The aluminum plate was laid on a flat surface and  ... the same method to compare with nanophased system.
4269,10.1007/s10008-011-1623-1,something_else,"In this study, we utilized Al nanoparticles in epo ... py (FIB- TEM) after wet/dry cyclic corrosion test."
4270,10.1016/j.cattod.2012.03.081,something_else,"In a 50 ml double neck RB equipped with a magnetic ... eparately listed, if clear separation is obtained."
4271,10.1016/j.cattod.2012.03.081,something_else,ethyl 2-oxo-2-p-tolylacetate was prepared accordin ... give the α-keto acid (2-oxo-2-p-tolylacetic acid).
4272,10.1016/j.cattod.2012.03.081,something_else,In a 100 ml double neck RB equipped with a magneti ... ate mixture to obtain the product 1j in 30% yield.
4273,10.1016/j.cattod.2012.03.081,something_else,"In a 50 ml RB flask, ethyl 2-oxo-4-phenylbutanoate ... cetate mixture to give the product 1i (30% yield)."
4274,10.1016/j.cattod.2012.03.081,something_else,"C. parapsilosis ATCC 7330 was purchased from ATCC  ... ometer operating at 500 and 125 MHz, respectively."
4275,10.1016/j.fuproc.2015.01.014,something_else,Changes in biodiesel properties were monitored by  ... the use of SUPELCO FAME-mix 18 component standard.
4276,10.1016/j.fuproc.2015.01.014,something_else,A microcosm test was constructed to study corrosio ... sks. Experimental test matrix is given in Table 2.
4277,10.1016/j.fuproc.2015.01.014,something_else,Corrosion tests were executed according to the rec ... ights of cleaned coupons was registered to 0.1 mg.
4278,10.1016/j.cattod.2012.03.081,something_else,(i) Racemic mandelamide rac-4a and its ring substi ... ts corresponding optically pure compounds R-4a-4e.
4279,10.1016/j.conbuildmat.2016.03.143,something_else,Methodology for the mix design of self-compacting  ... rent mineral additions in binary blends of powders
4280,10.1016/j.cej.2013.08.003,something_else,A stable emulsion of uniformly small water droplet ... one hour larger droplets became visible (Fig. 9d).
4281,10.1016/j.cej.2013.08.003,something_else,The organic droplets were cured and dried to allow ... n epoxy resin and fracturing the hardened samples.
4282,10.1016/j.cej.2013.08.003,something_else,"In order to analyze particle vesiculation and morp ... se, the samples were sputtered with gold/platinum."
4283,10.1016/j.cej.2013.08.003,something_else,"A two-step MVPs production was also implemented, i ... ed stirring for 15 min with a helix-type impeller."
4284,10.1016/j.cej.2013.08.003,something_else,"Both organic and aqueous phases were characterized ... evice Dataphysics OCA 20, being equal to 1.5 mN/m."
4285,10.1016/j.cej.2013.08.003,something_else,The same composition of the organic and aqueous ph ... roxide and 0.02 wt.% ammoniacal ferrous sulphate).
4286,10.1016/j.cej.2013.08.003,something_else,Unsaturated polyester was provided by Resiquimica  ... re supplied by Sigma-Aldrich and used as received.
4287,10.1016/j.cej.2013.08.003,something_else,Multivesiculated polyester particles (MVPs) have b ... n incorporation in non-matte coatings is intended.
4288,10.1016/j.conbuildmat.2016.03.143,something_else,Methodology for mix design of the mortar phase of  ... rent mineral additions in binary blends of powders
4289,10.1002/smll.201402756,something_else,Water Splitting Experiments: All the water splitti ... 1 mmol mL-1 KH2PO4 aqueous solution with pH = 7.0.
4290,10.1016/j.cattod.2012.03.081,something_else,"C. parapsilosis ATCC 7330 was grown in yeast malt  ... er (pH 7.2, 10 mM) and used for biotransformation."
4291,10.1016/j.cattod.2012.03.081,something_else,6.4 g wet cells of C. parapsilosis ATCC 7330 was s ...  the reduction of remaining primary α-keto amides.
4292,10.1016/j.cemconres.2016.06.009,something_else,Standard mortars were prepared according to EN 196 ...  strength measurements (and one heat measurement).
4293,10.1016/j.cemconres.2016.06.009,something_else,Cement production essentially takes place in three ... rd cement from leaving the plant for the consumer.
4294,10.1016/j.ces.2014.05.019,something_else,"Heterogeneous nucleation of clathrates from superc ... ater mixtures, and the effect of an added catalyst"
4295,10.1016/j.ces.2014.05.019,something_else,Experimental temperature profiles. Conversion time ... elt until the whole drop has converted to hydrate.
4296,10.1016/j.ces.2014.05.019,something_else,A strain controlled rheometer (ARES-G2) with Couet ... til the measured viscosity reached a steady value.
4297,10.1016/j.ces.2014.05.019,something_else,Rheometric analysis was performed on density-match ... igible within the experimental times in this work.
4298,10.1016/j.ces.2014.05.019,something_else,"at -30 degC, another 10 μL water was put on top of ... ed in step 1, to form a taller columnar structure;"
4299,10.1016/j.ces.2014.05.019,something_else,Ice was formed by initially freezing 10 μL deioniz ... anchored at a 1 mm hole in the middle of the well;
4300,10.1016/j.cattod.2012.03.081,something_else,6.4 g wet cells of C. parapsilosis ATCC 7330 was s ...  were not isolated due to their low conversion/ee.
4301,10.1016/j.ces.2014.05.019,something_else,"In the single drop experiments, cyclopentane was t ... lved at 5% (w/w) in deionized water to form brine."
4302,10.1016/j.actamat.2016.10.064,something_else,The disk-shaped samples for TEM analysis were cut  ... on. The accuracy of EDX measurements was about 1%.
4303,10.1016/j.actamat.2016.10.064,something_else,The alloy was produced by continuous casting and t ... sulting billets were subjected to ECAP processing.
4304,10.1016/j.tetlet.2010.03.088,something_else,"Hydroxylamine hydrochloride (0.38 g, 5.5 mmol), tr ... , 6H), 7.95 (d, 2H), 7.75 (m, 12H), 1.80 (s, 36H)."
4305,10.1016/j.tetlet.2010.03.088,something_else,"We have adopted an one-pot, mild reaction conditio ... spectroscopy, and cyclic voltammetry (see Fig. 1)."
4306,10.1016/0040-4039(96)00644-2,something_else,"Commercial palladium on carbon (10%, Aldrich) was  ... ting at 180degC for 12 h under vacuum (10-1 Torr)."
4307,10.1016/j.jcis.2015.06.012,something_else,PPG-5-CETETH-20 (Procetyl(r) AWS) was purchased fr ...  extracted by hydrodistillation in the laboratory.
4308,10.1016/j.cattod.2012.03.081,something_else,Organic solvents have been reportedly used to impr ... e was used as the cosolvent for further reactions.
4309,10.1016/j.cattod.2012.03.081,something_else,The viability of the cells during the bioreduction ... s 5 mmol glucose and 24 h reaction time were used.
4310,10.1016/j.ces.2014.05.019,something_else,"In the rheological experiments, 5% (w/w) sodium ch ... operties of the materials are provided in Table 1."
4311,10.1016/j.tet.2007.06.063,something_else,An aqueous suspension of Raney Ni (4.25 g) was add ... r C20H36Na O2 [M+Na]+ 331.2613 and found 331.2625.
4312,10.1002/smll.201402756,something_else,Characterization. The powder X-ray diffraction (XR ...  Perkin Elmer/Spectrum GX FTIR Spectrometer (USA).
4313,10.1002/smll.201402756,something_else,Growth of Au Nanoparticles on CdS Nanocrystals: Br ... dispersed in toluene for further characterization.
4314,10.1016/j.nima.2007.07.027,something_else,The MIS (Au/SnO2/n-Si) structures used in this wor ...  the strong accumulation region for MIS structure.
4315,10.1016/j.solidstatesciences.2014.03.003,something_else,ITO and ZnO:Al films were deposited on non-alkali  ... ntrolled to obtain specific film surface features.
4316,10.1016/j.jpcs.2009.07.016,something_else,"Thin films of Ge (99.99%) were deposited on glass  ... 8, and 823 K at constant annealing time of 30 min."
4317,10.1002/cnma.201600096,something_else,"A 10 mL ethanol dispersion of PtCu nanosheets (con ... filtered, and analyzed by gas chromatography (GC)."
4318,10.1002/cnma.201600096,something_else,"In a typical synthesis of PtCu alloy nanosheets, 2 ... n and further purified by a water-acetone mixture."
4319,10.1002/cnma.201600096,something_else,"In a typical synthesis of PtCu alloy nanosheets, C ... d washed several times with water-acetone mixture."
4320,10.1016/j.wear.2013.08.009,something_else,Hydrogen generation from coupling reactions of sod ... um powder with aqueous solution of cobalt chloride
4321,10.1016/j.solmat.2005.04.010,something_else,ZnO thin films were prepared by chemical spray usi ... d using a scanning electronic microscope JEOL 35C.
4322,10.1002/cbin.10461,something_else,All protocols in the current study were approved b ...  in a 37degC tissue culture incubator with 5% CO2.
4323,10.1016/j.biomaterials.2010.01.026,something_else,"In general, oxygen permeation through silicone hyd ... example, 600 barrer for polydimethylsiloxane [32]."
4324,10.1016/j.biomaterials.2010.01.026,something_else,The captive-bubble method was used to determine th ... es for each sample and the average was calculated.
4325,10.1016/j.biomaterials.2010.01.026,something_else,The optical transparencies of the hydrogels swelle ...  was found to correspond to a thickness of 100 μm.
4326,10.1016/j.biomaterials.2010.01.026,something_else,"Thermal gravimetric analysis (TGA: ETSAR6000, TG/D ... 0 degC with a 10 degC/min temperature change rate."
4327,10.1016/j.biomaterials.2010.01.026,something_else,"Mixtures of SiMA, TEGDMA(1.0 mol % to SiMA), and D ... The preparation results are summarized in Table 1."
4328,10.1016/j.biomaterials.2010.01.026,something_else,Various proportions of SiMA and MPC (total monomer ...  polymerization results are summarized in Table 1.
4329,10.1016/j.biomaterials.2010.01.026,something_else,"MPC was obtained from NOF Co., Ltd., Tokyo, Japan. ... Ltd., and prepared under the recommended protocol."
4330,10.1007/s10008-011-1623-1,something_else,Equivalent circuit diagram for steel coated by epo ... est in 0.1 M NaCl solution for different durations
4331,10.1007/s10008-011-1623-1,something_else,The chemical composition of the CS specimens in ma ... d with distilled water and acetone before coating.
4332,10.1016/j.biomaterials.2010.01.026,something_else,A single protein adsorption test was conducted to  ...  using the same protein adsorption test procedure.
4333,10.1002/smll.201402756,something_else,Fabrication of photoelectrochemical cell (PEC) Dev ... efore it was used for water splitting experiments.
4334,10.1002/cbin.10461,something_else,To introduce local anesthetic-induced neuronal inj ... red for additional 24 h before further evaluation.
4335,10.1002/cbin.10461,something_else,"Three days after bupivacaine treatment, to measure ... length under control condition (0 mM bupivacaine)."
4336,10.1002/smll.201402756,something_else,"Chemicals: Cadmium chloride (CdCl2, 99.995%, Sigam ... ere used as received without further purification."
4337,10.1016/j.electacta.2007.02.062,something_else,DSC was carried out on a STA 409 PC instruments (N ... C thermograms during the programmed heating steps.
4338,10.1016/j.electacta.2007.02.062,something_else,"BMPyTFSI was prepared by anion exchange reaction f ... ), 1136 cm-1 (vs, δSO), 1058 cm-1 (vs, δC-F), etc."
4339,10.1016/j.electacta.2007.02.062,something_else,"PEO (Mw = 600,000, Aldrich), LiTFSI (Aldrich), 1-b ... ghai Reagent) were used as the starting materials."
4340,10.1016/j.msea.2012.01.045,something_else,At first the cement slurry was poured in to a slur ... n 10A standard [20] using the Fann 35 device [21].
4341,10.1016/j.msea.2012.01.045,something_else,"In order to verify free-fluid content an atmospher ... rcent free fluid, utilizing the following formula:"
4342,10.1016/j.msea.2012.01.045,something_else,Compressive strength was measured using Ultrasonic ... nd the load was applied with a rate of 72 +- 7 kN.
4343,10.1016/j.msea.2012.01.045,something_else,At first the slurry was loaded in to a slurry cont ... in and 30 min of the stirring period was reported.
4344,10.1002/cbin.10461,something_else,"Cultured DRG neurons were lifted and trypsinized i ... n a FACSCalibur cytometer (Becton Dickinson, USA)."
4345,10.1016/j.msea.2012.01.045,something_else,In foam cementing method nitrogen is injected in t ... Litecrete cement designed by Schlumberger Company.
4346,10.1016/j.matchemphys.2015.03.051,something_else,The phase identification and purity of the powder  ... as completely within the sample for all 2θ angles.
4347,10.1016/j.matchemphys.2015.03.051,something_else,To prepare the compound we used a traditional in a ... Ni2FeSbO6 did not form in this preparation method.
4348,10.1002/cbin.10461,something_else,"Effects of bupivacaine on neurite outgrowth and mi ... aine (*P < 0.05, as compared to 0 mM bupivacaine)."
4349,10.1002/cbin.10461,something_else,"As we showed apoptosis was induced in DRG culture  ... anner from 0.5 mM to 10 mM (Figure 2B, *P < 0.05)."
4350,10.1002/cbin.10461,something_else,"DRG neurons were extracted from 8-week old C57BL/6 ... on a dose-dependent manner (Figure 1C, *P < 0.05)."
4351,10.1002/cbin.10461,something_else,"Cultured DRG neurons were lifted and trypsinized i ... ham Biosciences, USA) per manufacturer's protocol."
4352,10.1002/cbin.10461,something_else,The mouse miRNA mimics Negative Control (miR-NC) a ... a in DRG neurons were examined by qRT-PCR in 24 h.
4353,10.1002/cbin.10461,something_else,"Cultured DRG neurons were lifted and trypsinized i ... for mmu-miR-26a, and GAPDH for PTEN, respectively."
4354,10.1016/j.msea.2012.01.045,something_else,"First, at room temperature Na2SiO3*9H2O (70 g) (Me ... s were removed by calcination at 570 degC for 8 h."
4355,10.1016/j.tet.2007.06.063,something_else,"To a solution of the aldehyde 10 (1.0 g, 2.10 mmol ...  in the oxidative cleavage of the diol mixture 6)."
4356,10.1016/j.tet.2007.06.063,something_else,"A solution of NaIO4 (0.968 g, 4.56 mmol, 1.5 equiv ... r C27H38NaO5S [M+Na]+ 497.2337 and found 497.2333."
4357,10.1016/j.tet.2007.06.063,something_else,"To a stirred solution of the tosylate 8 (3 g, 6.78 ... mL) and their individual spectral data were given."
4358,10.1016/j.jim.2007.11.008,something_else,Forty micrograms of total protein from each cancer ... nd developed using Super-Signal WestPico reagents.
4359,10.1016/j.jim.2007.11.008,something_else,PrEC cells were plated into 96-well flat bottom pl ...  Molecular Devices Vmax kinetic microplate reader.
4360,10.1016/j.jim.2007.11.008,something_else,Adherent PC-3 cells (~ 1.2 x 107 total) were block ... were additional rounds of PC-3 positive selection.
4361,10.1016/j.jim.2007.11.008,something_else,"PC-3 Fab library DNA (IgG1κ and IgG2aκ, 10 μg each ...  in a 3-mL syringe, then dialyzed into 1 L of PBS."
4362,10.1016/j.jim.2007.11.008,something_else,"After obtaining the Internal Review Board approval ... ch time, and repeated for a total of three rounds."
4363,10.1016/j.jim.2007.11.008,something_else,"Primary antibody, pre-bleeds, post-bleeds, subtrac ... lated using CellQuest software (Becton Dickinson)."
4364,10.1016/j.jim.2007.11.008,something_else,"Phycoerythrin (PE)-conjugated goat anti-mouse IgG, ... ptavidin were obtained from Pierce (Rockford, IL)."
4365,10.1016/j.apcata.2007.06.017,something_else,Extrudates comprising zeolite were exposed to at l ... lcination in air was performed as described above.
4366,10.1016/j.jorganchem.2012.03.034,something_else,1H and 13C NMR spectra were recorded on a Bruker A ... aldehyde (For details see supporting information).
4367,10.1016/j.apcata.2007.06.017,something_else,"Mixing of solids and HEC solution was always carri ... min, and where they were kept at 550 degC for 3 h."
4368,10.1016/j.apcata.2007.06.017,something_else,"In the extrusion experiments, the solids were empl ... nd AlPO4 matrix in the final, calcined extrudates."
4369,10.1016/j.jcis.2015.06.016,something_else,This work was partially supported by a Grant-in-Ai ... chno Co. Ltd. for the gift of TiO2 (A-100) sample.
4370,10.1016/j.jcis.2015.06.016,something_else,"First, after Au/TiO2 particles (0.10 g) had been p ... m the reaction chamber by using gas tight syringe."
4371,10.1016/j.jcis.2015.06.016,something_else,TiO2 or Au/TiO2 particles (0.1 g) were placed in a ... m the reaction chamber by using gas tight syringe.
4372,10.1016/j.jcis.2015.06.016,something_else,"Anatase TiO2 particles with different surface area ... coupled plasma spectroscopy (ICPS-7500, Shimadzu)."
4373,10.1016/j.ces.2009.09.032,something_else,After initial runs at 2% loading were performed to ... ing were performed to investigate reproducibility.
4374,10.1016/j.ces.2009.09.032,something_else,The required amount of catalyst and polyethylene w ... flow of 100 ml/min plus 20 ml/min protective flow.
4375,10.1016/j.jpowsour.2005.03.047,something_else,The unit cell was assembled by sandwiching the sep ... as cut-off at 20% of the initial constant current.
4376,10.1016/j.apcata.2007.06.017,something_else,The solids need to be suspended in a liquid in ord ... urpose. The dissolved HEC serves as a plasticizer.
4377,10.1016/j.jpowsour.2005.03.047,something_else,The novel porous separator (bare separator) based  ...  h to remove the residual solvent and water trace.
4378,10.1016/j.jorganchem.2012.03.034,something_else,4a or 4b (2 mmol) and 10 mL of anhydrous acetonitr ... under reduced pressure to yield the ligands L1-L4.
4379,10.1016/j.jorganchem.2012.03.034,something_else,"The chiral complex C1 (0.25 x 10-2 mmol) and 1,3-d ...  40:1) to afford the epoxide product in 82% yield."
4380,10.1016/j.fuproc.2015.01.015,something_else,"Before the reaction, the gas line was switched to  ... CH4 content in the outlet gas [27], [30] and [45]."
4381,10.1016/j.fuproc.2015.01.015,something_else,"Catalyst testing was carried out in a fixed bed mi ... or analysis (Agilent 7890, with TCD, FID and FPD)."
4382,10.1016/j.fuproc.2015.01.015,something_else,The QDB-5 series catalysts containing nominal K2O  ... some metal salts contacting the impregnation tank.
4383,10.1016/j.fuproc.2015.01.015,something_else,The new K containing SWGS catalysts were prepared  ... re x represents the K2CO3 content in the catalyst.
4384,10.1016/j.fuproc.2015.01.015,something_else,The Mg modified alumina support material was prepa ... pinel modified γ-Al2O3 is marked as Al2O3-MgAl2O4.
4385,10.1016/j.cemconres.2016.06.006,something_else,Carbonation profiles after 91 days of CO2 exposure ... btracted from the total measured CaCO3 quantities.
4386,10.1016/j.cemconres.2016.06.006,something_else,"The carbonation depths, as measured by the phenolp ... uare root time dependency (x = K t1/2) is assumed."
4387,10.1016/j.cemconres.2016.06.006,something_else,The pore structure of the mortars was characterize ...  corresponding to a minimum pore radius of 3.6 nm.
4388,10.1016/j.jorganchem.2012.03.034,something_else,"Under an Ar atmosphere, Mn(CF3SO3)2 (0.1 mmol) was ...  dried under vacuum to give the desired complexes."
4389,10.1016/j.cemconres.2016.06.006,something_else,"Carbonation depths were measured after 0, 7, 14, 2 ... mortar inhomogeneity originating from the casting."
4390,10.1016/j.cemconres.2016.06.006,something_else,The mortar bars were cast into 40 x 40 x 160 mm3 m ... lid ratio of 3:1 by volume at 20 degC for 91 days.
4391,10.1016/j.cemconres.2016.06.006,something_else,The compositions of the binders (Table 2) targeted ... ithin +- 5% of the flow of the reference P mortar.
4392,10.1016/j.cemconres.2016.06.006,something_else,The binders used in this study were made from a wh ...  was used to achieve similar flow for all mortars.
4393,10.1016/j.matlet.2014.12.036,something_else,"Decoloration: Adsorption of RhB was carried out in ... e, and C is the residual concentration of the dye."
4394,10.1016/j.matlet.2014.12.036,something_else,"Preparation: For preparation of CoPc@BC, following ...  and then rinsed three times with ultrapure water."
4395,10.1016/j.matlet.2014.12.036,something_else,A novel cobalt tetraaminophthalocyanine decorated  ... nanocomposite (CoPc@BC) was designed and prepared.
4396,10.1016/j.jorganchem.2012.03.034,something_else,"Reactions were carried out in 1.5 mL of CH3CN for  ... .25 mmol of substrate, 1 mol% C1, 1.2 equiv AcOOH."
4397,10.1016/j.jorganchem.2012.03.034,something_else,"Unless otherwise stated, reactions were carried ou ... one, 1 mol% catalyst, 1.2 equiv of peracetic acid."
4398,10.1016/j.cemconres.2016.06.006,something_else,After 91 days of hydration under the conditions gi ... e RH range of 40-70% for maximum carbonation [17].
4399,10.1016/j.fuproc.2015.01.015,something_else,The industrial operation results were obtained fro ... exit CH4 were recorded for comparison in parallel.
4400,10.1016/j.jnoncrysol.2010.03.037,something_else,Glass compositions prepared in this study were 60. ...  to optical quality prior to optical measurements.
4401,10.1016/j.memsci.2015.03.076,something_else,"Analyzing, by Eq.(13), a solution of seawater simu ...  increase the volumetric requirements of seawater."
4402,10.1016/j.jmbbm.2012.02.017,something_else,Hank's solution was used in the lubricated wear te ... ts were carried out at room temperature (25+-3deg)
4403,10.1016/j.electacta.2007.02.021,something_else,Rectangular samples (with dimensions 10 mm x 10 mm ...  of analytical grade reagents and distilled water.
4404,10.1007/s10854-015-3483-4,something_else,"For device preparation, the ZnO colloidal nanorods ... tive back electrode with active areas of 0.12 cm2."
4405,10.1007/s10854-015-3483-4,something_else,ZnO colloidal nanorods were prepared according to  ...  and the nanorod concentration was about 15 mg/mL.
4406,10.1007/s10854-015-3483-4,something_else,"Zinc acetate dehydrate [Zn(CH3COO)2*2H2O, purity 9 ... trogen gas, then treated with O2 plasma for 5 min."
4407,10.1016/j.tsf.2009.03.078,something_else,AlCrTaTiZr five-element HEAN films were deposited  ... as applied to the films in a vacuum of 10- 6 Torr.
4408,10.1016/j.jpowsour.2010.12.043,something_else,Another possible explanation from our observations ... s the need to use an oven for solvent evaporation.
4409,10.1016/j.jpowsour.2010.12.043,something_else,"In this study, we have investigated four different ... s that colloidal inks produce better performances."
4410,10.1016/j.matlet.2007.03.042,something_else,A Shimadzu Differential Thermal Analyzer was used  ... gC with a heating temperature rate of 10 degC/min.
4411,10.1016/j.jpowsour.2010.12.043,something_else,A thin layer of Nafion(r) solution (Nafion(r) dry  ... sides in H2 and air (1.2/2.2 stoics) respectively.
4412,10.1016/j.jpowsour.2010.12.043,something_else,All materials were used as received without any fu ... of 0.5 mg cm-2) were purchased from Fuelcellstore.
4413,10.1016/j.matlet.2006.06.060,something_else,Experimental results indicated that 90% of Ag tran ...  to Ag and its effect can be expressed as follows:
